Table	Section	Functionalities	Package	Code_link	Repo
Table 7: R Packages for molecule structures and chemical structure databases.	Database queries	Querying information from a large number of databases.	webchem	https://cran.r-project.org/package=webchem	CRAN
Table 7: R Packages for molecule structures and chemical structure databases.	Database queries	R Interface to the ClassyFire REST API.	classyfireR	https://cran.r-project.org/web/packages/classyfireR/index.html	CRAN
Table 7: R Packages for molecule structures and chemical structure databases.	Database queries	Allows mapping of identifiers from one database to another, for metabolites, genes, proteins, and interactions.	BridgeDbR	https://doi.org/10.18129/B9.bioc.BridgeDbR	BioC
Table 7: R Packages for molecule structures and chemical structure databases.	Database queries	Define utilities for exploration of human metabolome database, including functions to retrieve specific metabolite entries and data snapshots with pairwise associations.	hmdbQuery	https://doi.org/doi:10.18129/B9.bioc.hmdbQuery	BioC
Table 7: R Packages for molecule structures and chemical structure databases.	Database queries	Parsers for many compound databases including HMDB, MetaCyc, ChEBI, FooDB, Wikidata, WikiPathways, RIKEN respect, MaConDa, T3DB, KEGG, Drugbank, LipidMaps, MetaboLights, Phenol-Explorer, MassBank.	MetaDBparse	https://github.com/UMCUGenetics/MetaDBparse	GitHub
Table 7: R Packages for molecule structures and chemical structure databases.	Database queries	Functionality to create and use compound databases generated from (mostly publicly) available resources such as HMDB, ChEBI and PubChem.	CompoundDb	https://github.com/EuracBiomedicalResearch/CompoundDb	GitHub
Table 7: R Packages for molecule structures and chemical structure databases.	Database queries	Standardized and extensible framework to query chemical and biological databases.	biodb	https://github.com/pkrog/biodb	GitHub